{
  "$schema": "https://json-schema.org/draft/2020-12/schema",
  "$id": "https://kais.shot-timeline/spec/schemas/props.schema.json",
  "draft": "2020-12",
  "title": "道具注册表(跨镜道具身份 + 状态变体)",
  "description": "Canonical cross-shot prop registry. Producer (Phase 7/8 apply_edits.py) writes props.json after HITL review; consumer (canvas in Phase 9) reads it to render prop child nodes + attach prop_refs to prompts. 严格遵守 v1.0 的 strict-schema × lenient-consumer 原则。注意语义精度优先于 schema 统一:道具用 states[](开/关、完好/破碎),不与角色的 looks[](服装)合并为单一 entity schema。",
  "$comment": "Pitfall 5 (identity drift scope): 道具 ID 是 asset-local 的。Pitfall 17 (prompt dangling): ID 不可变——一旦 confirmed,reviewer 可以 merge/split 但 ID 永不重用或重排版(保证 prompts.json#prop_refs[] 引用永不悬空)。Pitfall 7 (review_state gating): 只有 'confirmed' 流向下游。道具与角色的语义区别:道具按 state(开/关、完好/破碎)变体,不是按 costume。",
  "type": "array",
  "items": {
    "type": "object",
    "additionalProperties": false,
    "required": ["id", "name", "review_state"],
    "properties": {
      "id": {
        "type": "string",
        "pattern": "^prop_[0-9]{3}$",
        "description": "不可变道具 ID(零填充 3 位)。Pattern 在 Phase 5 锁定;一旦 confirmed,永不重用或重排版(Pitfall 17)。"
      },
      "name": {
        "type": "string",
        "minLength": 1,
        "description": "展示名(如 '落叶'、'神秘信件'、'断裂的剑')。reviewer 可编辑;ID 不可编辑。"
      },
      "representative_image": {
        "type": "string",
        "pattern": "^(?!.*\\.\\.)([^/]+/)*props/[^:*?\"<>|]+\\.png$",
        "description": "External png 相对路径(NOT base64——asset 体积膨胀防护)。Anti-traversal: 拒绝 ../、绝对路径、Windows 保留字符。Canonical 命名: props/<id>.png。"
      },
      "appearance_shots": {
        "type": "array",
        "items": {
          "type": "integer",
          "minimum": 1
        },
        "description": "该道具出现的 shot ID 列表(交叉引用 shots.json#id)。Phase 8 据此把 prop_refs[] 挂到对应 prompts.json 条目。"
      },
      "review_state": {
        "enum": ["proposed", "confirmed", "rejected"],
        "description": "HITL 审阅门控。只有 'confirmed' 的条目流向下游 prompt 引用(Pitfall 7)。'proposed' = re-id 聚类草稿;'rejected' = 软删除(ID 保留以维护引用完整性)。"
      },
      "states": {
        "type": "array",
        "items": {
          "$ref": "#/$defs/state"
        },
        "description": "可选状态变体(开/关、完好/破碎)。道具按 state 变体,与角色的 looks[](服装)语义区分——刻意不统一。"
      }
    }
  },
  "$defs": {
    "state": {
      "type": "object",
      "additionalProperties": false,
      "required": ["label", "image_ref"],
      "properties": {
        "label": {
          "type": "string",
          "minLength": 1,
          "description": "状态名(如 '打开'、'关闭'、'完好'、'破碎')。"
        },
        "image_ref": {
          "type": "string",
          "pattern": "^(?!.*\\.\\.)([^/]+/)*props/[^:*?\"<>|]+\\.png$",
          "description": "该 state 对应的 external png。与 representative_image 共用同一 anti-traversal pattern。"
        },
        "appearance_shots": {
          "type": "array",
          "items": {
            "type": "integer",
            "minimum": 1
          },
          "description": "该 state 出现的 shot ID 列表(父道具 appearance_shots[] 的子集)。"
        }
      }
    }
  }
}
